{
  "catalog_kind": "DATAX_COMPLETE_CAPABILITY_TARGET_SET",
  "completion_rule": {
    "ordinary_user_execution_requires": [
      "BUILD_VERIFIED",
      "LICENSE_REVIEWED",
      "CONTRACTED",
      "E3_CERTIFIED",
      "WINDOWS_E4_CERTIFIED",
      "RELEASE_PROMOTED_FOR_SAME_FINAL_PACKAGE"
    ],
    "statement_rule": "Every target item not explicitly unsupported by an accepted ADR must be Windows E4 certified and release promoted for the same final package."
  },
  "counts": {
    "CORE_EXECUTION_SURFACE": 5,
    "NATIVE_TRANSFORMER": 6,
    "READER_PLUGIN": 31,
    "WRITER_PLUGIN": 41,
    "explicitly_unsupported_v1": 6,
    "item_count": 83,
    "windows_e4_certified_count": 0
  },
  "items": [
    {
      "id": "CORE_ARBITRARY_JOB_JSON",
      "kind": "CORE_EXECUTION_SURFACE",
      "module": "core",
      "name": "Arbitrary DataX job JSON",
      "ordinary_user_executable": false,
      "plugin_name": null,
      "required_e3_test_id": "E3-CAP-ARBITRARY-JOB-JSON",
      "required_e4_test_id": "E4-CAP-ARBITRARY-JOB-JSON",
      "risk_category": "ARBITRARY_EXECUTION_CONFIGURATION",
      "source_evidence_level": "SOURCE_PRESENT",
      "source_files": [
        {
          "path": "third_party/alibaba-datax/core/src/main/java/com/alibaba/datax/core/Engine.java",
          "sha256": "9ec430d6fda5b036bf0af23aba166b336d213a354b143d09d9c74df7100cb315"
        }
      ],
      "v1_disposition": "EXPLICITLY_UNSUPPORTED_V1"
    },
    {
      "id": "CORE_EXTERNAL_TRANSFORMER_LOADING",
      "kind": "CORE_EXECUTION_SURFACE",
      "module": "core",
      "name": "External transformer JAR loading",
      "ordinary_user_executable": false,
      "plugin_name": null,
      "required_e3_test_id": "E3-CAP-EXTERNAL-TRANSFORMER-LOADING",
      "required_e4_test_id": "E4-CAP-EXTERNAL-TRANSFORMER-LOADING",
      "risk_category": "USER_SUPPLIED_CODE",
      "source_evidence_level": "SOURCE_PRESENT",
      "source_files": [
        {
          "path": "third_party/alibaba-datax/core/src/main/java/com/alibaba/datax/core/transport/transformer/TransformerRegistry.java",
          "sha256": "df7cce1354d52e242d6e954f096b7bff2f6c322a0ec957655c8832783dacff04"
        }
      ],
      "v1_disposition": "EXPLICITLY_UNSUPPORTED_V1"
    },
    {
      "id": "CORE_POST_SQL",
      "kind": "CORE_EXECUTION_SURFACE",
      "module": "core",
      "name": "Plugin postSql hooks",
      "ordinary_user_executable": false,
      "plugin_name": null,
      "required_e3_test_id": "E3-CAP-POST-SQL",
      "required_e4_test_id": "E4-CAP-POST-SQL",
      "risk_category": "ARBITRARY_SQL",
      "source_evidence_level": "SOURCE_PRESENT",
      "source_files": [
        {
          "path": "third_party/alibaba-datax/odpsreader/src/main/java/com/alibaba/datax/plugin/reader/odpsreader/OdpsReader.java",
          "sha256": "8e214f50ec976d316d2781a9ac10bc80c3dbf230c17ddaec9db20cc46c8aab85"
        },
        {
          "path": "third_party/alibaba-datax/postgresqlwriter/src/main/resources/plugin_job_template.json",
          "sha256": "6eb38c4bad42f87a52230b823c56509b26e264e0178456b318eb38228d12459c"
        }
      ],
      "v1_disposition": "EXPLICITLY_UNSUPPORTED_V1"
    },
    {
      "id": "CORE_PRE_SQL",
      "kind": "CORE_EXECUTION_SURFACE",
      "module": "core",
      "name": "Plugin preSql hooks",
      "ordinary_user_executable": false,
      "plugin_name": null,
      "required_e3_test_id": "E3-CAP-PRE-SQL",
      "required_e4_test_id": "E4-CAP-PRE-SQL",
      "risk_category": "ARBITRARY_SQL",
      "source_evidence_level": "SOURCE_PRESENT",
      "source_files": [
        {
          "path": "third_party/alibaba-datax/mysqlwriter/src/main/resources/plugin_job_template.json",
          "sha256": "47e62a52776fdd7288705132c6ff39dfaee50fa475e5e069151de1e683d3e2d9"
        },
        {
          "path": "third_party/alibaba-datax/postgresqlwriter/src/main/resources/plugin_job_template.json",
          "sha256": "6eb38c4bad42f87a52230b823c56509b26e264e0178456b318eb38228d12459c"
        }
      ],
      "v1_disposition": "EXPLICITLY_UNSUPPORTED_V1"
    },
    {
      "id": "CORE_QUERY_SQL",
      "kind": "CORE_EXECUTION_SURFACE",
      "module": "core",
      "name": "Reader querySql",
      "ordinary_user_executable": false,
      "plugin_name": null,
      "required_e3_test_id": "E3-CAP-QUERY-SQL",
      "required_e4_test_id": "E4-CAP-QUERY-SQL",
      "risk_category": "ARBITRARY_SQL",
      "source_evidence_level": "SOURCE_PRESENT",
      "source_files": [
        {
          "path": "third_party/alibaba-datax/rdbmsreader/src/main/resources/plugin_job_template.json",
          "sha256": "17d7b324438710d6c57e0b50a6cd0249664b0f7ddc1c5cc4f45dd1bed4db02a7"
        },
        {
          "path": "third_party/alibaba-datax/tdenginereader/src/main/java/com/alibaba/datax/plugin/reader/TDengineReader.java",
          "sha256": "1e11654f65603e87dd1153e6fed89ead5f4baaf410fce8ac47b4b7a5ec21c191"
        }
      ],
      "v1_disposition": "EXPLICITLY_UNSUPPORTED_V1"
    },
    {
      "id": "NATIVE_TRANSFORMER_DIGEST",
      "kind": "NATIVE_TRANSFORMER",
      "module": "core",
      "name": "dx_digest",
      "ordinary_user_executable": false,
      "plugin_name": null,
      "required_e3_test_id": "E3-CAP-NATIVE-DIGEST",
      "required_e4_test_id": "E4-CAP-NATIVE-DIGEST",
      "risk_category": "DATA_TRANSFORMATION",
      "source_evidence_level": "SOURCE_PRESENT",
      "source_files": [
        {
          "path": "third_party/alibaba-datax/core/src/main/java/com/alibaba/datax/core/transport/transformer/DigestTransformer.java",
          "sha256": "088e7d100a163d2dbdfcd07c54407912d081eba13f9b53a73f5d203cc98ca61c"
        },
        {
          "path": "third_party/alibaba-datax/core/src/main/java/com/alibaba/datax/core/transport/transformer/TransformerRegistry.java",
          "sha256": "df7cce1354d52e242d6e954f096b7bff2f6c322a0ec957655c8832783dacff04"
        }
      ],
      "v1_disposition": "FUTURE_CERTIFICATION_REQUIRED"
    },
    {
      "id": "NATIVE_TRANSFORMER_FILTER",
      "kind": "NATIVE_TRANSFORMER",
      "module": "core",
      "name": "dx_filter",
      "ordinary_user_executable": false,
      "plugin_name": null,
      "required_e3_test_id": "E3-CAP-NATIVE-FILTER",
      "required_e4_test_id": "E4-CAP-NATIVE-FILTER",
      "risk_category": "DATA_TRANSFORMATION",
      "source_evidence_level": "SOURCE_PRESENT",
      "source_files": [
        {
          "path": "third_party/alibaba-datax/core/src/main/java/com/alibaba/datax/core/transport/transformer/FilterTransformer.java",
          "sha256": "c056bd660a37b383689e4d96c706c5dc1a729d73ab23d69d59c825a458ae7c75"
        },
        {
          "path": "third_party/alibaba-datax/core/src/main/java/com/alibaba/datax/core/transport/transformer/TransformerRegistry.java",
          "sha256": "df7cce1354d52e242d6e954f096b7bff2f6c322a0ec957655c8832783dacff04"
        }
      ],
      "v1_disposition": "FUTURE_CERTIFICATION_REQUIRED"
    },
    {
      "id": "NATIVE_TRANSFORMER_GROOVY",
      "kind": "NATIVE_TRANSFORMER",
      "module": "core",
      "name": "dx_groovy",
      "ordinary_user_executable": false,
      "plugin_name": null,
      "required_e3_test_id": "E3-CAP-NATIVE-GROOVY",
      "required_e4_test_id": "E4-CAP-NATIVE-GROOVY",
      "risk_category": "USER_SUPPLIED_CODE",
      "source_evidence_level": "SOURCE_PRESENT",
      "source_files": [
        {
          "path": "third_party/alibaba-datax/core/src/main/java/com/alibaba/datax/core/transport/transformer/GroovyTransformer.java",
          "sha256": "40400e0905f1659d52f5566d3eb16f994298381e4bf34fd314784a7b3a8126c4"
        },
        {
          "path": "third_party/alibaba-datax/core/src/main/java/com/alibaba/datax/core/transport/transformer/TransformerRegistry.java",
          "sha256": "df7cce1354d52e242d6e954f096b7bff2f6c322a0ec957655c8832783dacff04"
        }
      ],
      "v1_disposition": "EXPLICITLY_UNSUPPORTED_V1"
    },
    {
      "id": "NATIVE_TRANSFORMER_PAD",
      "kind": "NATIVE_TRANSFORMER",
      "module": "core",
      "name": "dx_pad",
      "ordinary_user_executable": false,
      "plugin_name": null,
      "required_e3_test_id": "E3-CAP-NATIVE-PAD",
      "required_e4_test_id": "E4-CAP-NATIVE-PAD",
      "risk_category": "DATA_TRANSFORMATION",
      "source_evidence_level": "SOURCE_PRESENT",
      "source_files": [
        {
          "path": "third_party/alibaba-datax/core/src/main/java/com/alibaba/datax/core/transport/transformer/PadTransformer.java",
          "sha256": "87b5775ccb65ada534ffe8f839abb4d1693cfc416f1a5a886cae71d571678195"
        },
        {
          "path": "third_party/alibaba-datax/core/src/main/java/com/alibaba/datax/core/transport/transformer/TransformerRegistry.java",
          "sha256": "df7cce1354d52e242d6e954f096b7bff2f6c322a0ec957655c8832783dacff04"
        }
      ],
      "v1_disposition": "FUTURE_CERTIFICATION_REQUIRED"
    },
    {
      "id": "NATIVE_TRANSFORMER_REPLACE",
      "kind": "NATIVE_TRANSFORMER",
      "module": "core",
      "name": "dx_replace",
      "ordinary_user_executable": false,
      "plugin_name": null,
      "required_e3_test_id": "E3-CAP-NATIVE-REPLACE",
      "required_e4_test_id": "E4-CAP-NATIVE-REPLACE",
      "risk_category": "DATA_TRANSFORMATION",
      "source_evidence_level": "SOURCE_PRESENT",
      "source_files": [
        {
          "path": "third_party/alibaba-datax/core/src/main/java/com/alibaba/datax/core/transport/transformer/ReplaceTransformer.java",
          "sha256": "f83a2f81116e39d2522668471b7e55dd969d4e2c93e70d5cfc6d02ff83299875"
        },
        {
          "path": "third_party/alibaba-datax/core/src/main/java/com/alibaba/datax/core/transport/transformer/TransformerRegistry.java",
          "sha256": "df7cce1354d52e242d6e954f096b7bff2f6c322a0ec957655c8832783dacff04"
        }
      ],
      "v1_disposition": "FUTURE_CERTIFICATION_REQUIRED"
    },
    {
      "id": "NATIVE_TRANSFORMER_SUBSTR",